{
  "schemaVersion": "editorial://schema/inspect-report/v1",
  "operationId": "11111111-1111-4111-8111-111111111111",
  "media": {
    "path": "/tmp/editorial-run/output.mp4",
    "sha256": "aaaaaaaaaaaaaaaaaaaaaaaaaaaaaaaaaaaaaaaaaaaaaaaaaaaaaaaaaaaaaaaa"
  },
  "renderManifestHash": "bbbbbbbbbbbbbbbbbbbbbbbbbbbbbbbbbbbbbbbbbbbbbbbbbbbbbbbbbbbbbbbb",
  "layoutTelemetry": {
    "path": "/tmp/editorial-run/layout-telemetry.json",
    "sha256": "cccccccccccccccccccccccccccccccccccccccccccccccccccccccccccccccc"
  },
  "frameCount": 2,
  "decodeStatus": "decoded",
  "streams": [
    {
      "index": 0,
      "kind": "video",
      "codec": "h264",
      "durationSeconds": 0.06666666666666667,
      "width": 1920,
      "height": 1080
    }
  ],
  "assetDecodeResults": [
    {
      "assetId": "asset-market-chart",
      "sha256": "dddddddddddddddddddddddddddddddddddddddddddddddddddddddddddddddd",
      "status": "decoded"
    }
  ],
  "warnings": [],
  "inspectedAt": "2026-07-22T10:02:00.000Z"
}
